{
  "_type": "https://govprov.dev/attestation/v1",
  "schema_version": "govprov.attestation.v1",
  "attestation_type": "ApprovalAttestation",
  "predicate_type": "https://govprov.dev/predicate/approval/v1",
  "subject": [
    {
      "name": "approval-1001",
      "digest": {
        "algorithm": "sha256",
        "value": "0x9d01d9cc5f74c443f3d944e7966bcadb7f1d414c3b024cec545c2da962eb31d4"
      },
      "uri": "cas://sha256/9d01d9cc5f74c443f3d944e7966bcadb7f1d414c3b024cec545c2da962eb31d4"
    }
  ],
  "parents": [
    "0xc8f7649c23afc338349034c0914d86a519929baee3cc5d8122805143897ccb7d",
    "0xcaed0105073367e811317ae1f9d706d87ec0922d7608993db4b415ea195d3179"
  ],
  "created_at": "2026-06-20T00:05:00Z",
  "created_by": {
    "actor_id": "govprov:actor:security-approver",
    "actor_type": "human",
    "ethereum_address": "0x7e5f4552091a69125d5dfcb7b8c2659029395bdf"
  },
  "governance_domain": "approval_domain",
  "governance_domain_type": "approval_authority_and_separation_of_duties",
  "governance_domain_id": "govreplay:domain:approval_domain",
  "policy": {
    "policy_id": "govprov:policy:delivery-v1",
    "policy_hash": "0x2222222222222222222222222222222222222222222222222222222222222222",
    "scope_hash": "0x3333333333333333333333333333333333333333333333333333333333333333"
  },
  "predicate": {
    "approval_id": "apr-1001",
    "decision": "approved",
    "approval_role": "SECURITY_APPROVER_ROLE",
    "action_hash": "0xc8f7649c23afc338349034c0914d86a519929baee3cc5d8122805143897ccb7d",
    "artifact_hash": "0xcaed0105073367e811317ae1f9d706d87ec0922d7608993db4b415ea195d3179",
    "policy_decision_hash": "0xe0b6dbd64183ad2580ed79070877ce479940c43feb16f8ef74fa9cf284624a44"
  },
  "attestation_hash": "0xadd69164cbae3eb9daa42661e9f3172ba2d273352a3bec95628156652bbc50c3",
  "signature": {
    "profile": "govprov-ethsign-secp256k1-v1",
    "signature": "0xd56433d9c69994f8ce89292fd9b3b34eecb776a70d649d93e087e29449f4bc420c8b1c25232c000e4cb5ffb2348ef0cab132278736d8ff24ea2bd7359839a94d1b",
    "signer": "0x7e5f4552091a69125d5dfcb7b8c2659029395bdf"
  }
}
