{
  "_type": "https://govprov.dev/attestation/v1",
  "schema_version": "govprov.attestation.v1",
  "attestation_type": "PolicyDecisionAttestation",
  "predicate_type": "https://govprov.dev/predicate/policy-decision/v1",
  "subject": [
    {
      "name": "policy-decision-1001",
      "digest": {
        "algorithm": "sha256",
        "value": "0xb068bbd691ced860302e9d26c105e2b636dc4b0f0a714e15d5d05f5e04d32c7f"
      },
      "uri": "cas://sha256/b068bbd691ced860302e9d26c105e2b636dc4b0f0a714e15d5d05f5e04d32c7f"
    }
  ],
  "parents": [
    "0xda9aabec00a30993efe65be811cf61aea76f978bd320a9649e3f81062da14f9c"
  ],
  "created_at": "2026-06-20T00:02:00Z",
  "created_by": {
    "actor_id": "govprov:actor:policy-service",
    "actor_type": "service",
    "ethereum_address": "0x6813eb9362372eef6200f3b1dbc3f819671cba69"
  },
  "governance_domain": "policy_domain",
  "governance_domain_type": "policy_registration_activation_and_decision_binding",
  "governance_domain_id": "govreplay:domain:policy_domain",
  "policy": {
    "policy_id": "govprov:policy:delivery-v1",
    "policy_hash": "0x2222222222222222222222222222222222222222222222222222222222222222",
    "scope_hash": "0x3333333333333333333333333333333333333333333333333333333333333333"
  },
  "predicate": {
    "decision": "allow",
    "obligations": [
      "security-approval",
      "artifact-digest"
    ],
    "policy_version": "delivery-v1",
    "evidence_bundle_hash": "0xda9aabec00a30993efe65be811cf61aea76f978bd320a9649e3f81062da14f9c"
  },
  "attestation_hash": "0xe0b6dbd64183ad2580ed79070877ce479940c43feb16f8ef74fa9cf284624a44",
  "signature": {
    "profile": "govprov-ethsign-secp256k1-v1",
    "signature": "0x259c39f0c00b974bd26fd6a2263b3c6be950282e4a30af29f3c128262ed83b8c629a012264139e4a4def7f3735144402d869ef47f7418afe14f140785bb3235c1b",
    "signer": "0x6813eb9362372eef6200f3b1dbc3f819671cba69"
  }
}
