{
  "_type": "https://govprov.dev/attestation/v1",
  "schema_version": "govprov.attestation.v1",
  "attestation_type": "AgentActionAttestation",
  "predicate_type": "https://govprov.dev/predicate/agent-action/v1",
  "subject": [
    {
      "name": "action-1001",
      "digest": {
        "algorithm": "sha256",
        "value": "0x736dc3c33a1ac9cc6dbb1890a825c2b78168f3aaacd9ea39dec30161f0d210b9"
      },
      "uri": "cas://sha256/736dc3c33a1ac9cc6dbb1890a825c2b78168f3aaacd9ea39dec30161f0d210b9"
    }
  ],
  "parents": [
    "0x316f52194a77bb724a1c4a560bcb48658e4ad15d8c242f6645c2f23211fadcf3",
    "0xda9aabec00a30993efe65be811cf61aea76f978bd320a9649e3f81062da14f9c",
    "0xe0b6dbd64183ad2580ed79070877ce479940c43feb16f8ef74fa9cf284624a44"
  ],
  "created_at": "2026-06-20T00:03:00Z",
  "created_by": {
    "actor_id": "govprov:actor:agent-alpha",
    "actor_type": "agent",
    "ethereum_address": "0x2b5ad5c4795c026514f8317c7a215e218dccd6cf"
  },
  "governance_domain": "audit_domain",
  "governance_domain_type": "audit_replay_reports_and_metrics",
  "governance_domain_id": "govreplay:domain:audit_domain",
  "policy": {
    "policy_id": "govprov:policy:delivery-v1",
    "policy_hash": "0x2222222222222222222222222222222222222222222222222222222222222222",
    "scope_hash": "0x3333333333333333333333333333333333333333333333333333333333333333"
  },
  "predicate": {
    "action_id": "act-1001",
    "action_type": "staging-deployment",
    "risk": "medium",
    "policy_decision_hash": "0xe0b6dbd64183ad2580ed79070877ce479940c43feb16f8ef74fa9cf284624a44",
    "evidence_bundle_hash": "0xda9aabec00a30993efe65be811cf61aea76f978bd320a9649e3f81062da14f9c"
  },
  "attestation_hash": "0xc8f7649c23afc338349034c0914d86a519929baee3cc5d8122805143897ccb7d",
  "signature": {
    "profile": "govprov-ethsign-secp256k1-v1",
    "signature": "0x17e05d324c899a19c279baca49a550632dc974fbeab9703f787a1a1566e60f5e0c2ad6d137b4faa217b5e9bd2c57675c312677bb2727ebba8e25ca13eca6e3231b",
    "signer": "0x2b5ad5c4795c026514f8317c7a215e218dccd6cf"
  }
}
