{
  "_type": "https://govprov.dev/attestation/v1",
  "schema_version": "govprov.attestation.v1",
  "attestation_type": "ObservationAttestation",
  "predicate_type": "https://govprov.dev/predicate/observation/v1",
  "subject": [
    {
      "name": "ticket-1001",
      "digest": {
        "algorithm": "sha256",
        "value": "0xe98cb0836e70fbe7d0ace6de0b450b14d579f9bddb2a65cb754be29726d7b116"
      },
      "uri": "cas://sha256/e98cb0836e70fbe7d0ace6de0b450b14d579f9bddb2a65cb754be29726d7b116"
    }
  ],
  "parents": [],
  "created_at": "2026-06-20T00:00:00Z",
  "created_by": {
    "actor_id": "govprov:actor:agent-alpha",
    "actor_type": "agent",
    "ethereum_address": "0x2b5ad5c4795c026514f8317c7a215e218dccd6cf"
  },
  "governance_domain": "audit_domain",
  "governance_domain_type": "audit_replay_reports_and_metrics",
  "governance_domain_id": "govreplay:domain:audit_domain",
  "policy": {
    "policy_id": "govprov:policy:delivery-v1",
    "policy_hash": "0x2222222222222222222222222222222222222222222222222222222222222222",
    "scope_hash": "0x3333333333333333333333333333333333333333333333333333333333333333"
  },
  "predicate": {
    "observation_id": "obs-1001",
    "source": "incident-ticket",
    "request_summary": "Prepare a governed staging deployment for service api."
  },
  "attestation_hash": "0x316f52194a77bb724a1c4a560bcb48658e4ad15d8c242f6645c2f23211fadcf3",
  "signature": {
    "profile": "govprov-ethsign-secp256k1-v1",
    "signature": "0xa3f2f321bedeaed091d24e2aacc2b31ff7702c0a8f70abddf48a964467b1adc94cc27e67e2a6b9b3cc190e9ffa6a602305eacca6980f04e88ee8230c1b36eb1c1b",
    "signer": "0x2b5ad5c4795c026514f8317c7a215e218dccd6cf"
  }
}
